productId,name,description,sku,barcode,price,originalPrice,discount,stock,sales,category,brand,images,tags,status,taxRate,isPriceInclusive,hsnCode,batchNo,expDate,manufactureDate,isWholesale,wholePrice,minQuantity,isCombination,slug,composition,productHighlights,productDescription,ingredients,keyUses,howToUse,safetyInformation,additionalInformation,faqs,manufacturerDetails,disclaimer
PROD013,"Nycil Germ Expert Classic Prickly Heat Powder 150gm","Clinically proven germ-fighting formula for summer skin protection",SKU013,BAR013,149,149,0,100,0,Personal care,"Zydus Wellness","https://drive.google.com/file/d/1nCoAhhM9_6L3E8ACzTgHGLuVSskFmLOu/view","prickly heat,powder,summer care",show,18,Yes,33049900,BATCH013,2026-06-30,2024-01-01,No,0,0,No,nycil-germ-expert-classic-prickly-heat-powder-150gm,"Dugdh Pasan (68.04 Gm) + Jasad Bhasma (5 Gm) + Makhya Satva (25 Gm) + Mentha Arvensis (0.5 Gm) + Neem Tails (Azadirachta Indica Oil) (0.5 Ml)","Clinically proven germ-fighting formula | Supports germ-killing for cleaner and healthier skin | Offers 3 visible results for summer skin problems like sweat, body odour, itching, rashes and prickly heat | Contains a unique antibacterial formula that protects from germs causing summer skin issues","Nycil Germ Expert Classic Prickly Heat Powder is used for providing visible relief from issues like sweat, body odour, itching, rashes and prickly heat in just three days. With over 50 years of expertise, Nycil remains a leading brand in the prickly heat and cooling powder category in India, offering long-lasting freshness and protection.","Starch: Natural absorbent that effectively soaks up excess moisture from the skin | Zinc Oxide: Known for its soothing and protective properties, helps calm irritated skin | Chlorphenesin: Potent antibacterial agent that helps eliminate harmful microbes | Purified Talc: Provides a smooth, cooling effect on the skin","Relieves Prickly Heat and Summer Rashes: Specifically designed to manage prickly heat and summer skin rashes | Reduces Excessive Sweating and Body Odour: Absorbs excess moisture and neutralises body odour | Soothes Itching and Skin Irritation: Calms itching and irritation caused by sweat or summer heat | Manages Germ Build-Up: Provides instant germ-killing action | Promotes Skin Cooling and Comfort: Ensures a cooling effect on the skin","Sprinkle powder on the affected area 3-4 times a day or as directed by the physician","Read the label carefully before use | Keep out of the reach of children | For external use only | Apply only to intact skin surfaces and not to skin wounds and open injuries | Avoid contact with eyes and mucous membranes | It should not be ingested | Store in a cool and dry place away from direct sunlight","Good to Know: Topical powder applied topically to reduce rashes | Quick Tips: Apply only to intact skin surfaces, Avoid contact with eyes and mucous membranes, For external use only, Wash hands after application",,Zydus Corporate Park S No 536 | Sarkhej-Gandhinagar Highway | Ahmedabad | Gujarat-382481 | Country of origin: INDIA,"We, at Farmacy kart make a diligent attempt to deliver accurate, expert- drafted and thoroughly reviewed medicine related information to our consumers. However, it should, by no means, be considered a substitute for prescription from a certified doctor or a trustworthy doctor-patient relationship."
PROD014,"Indulekha Bringha Oil 100ml","Ayurvedic hair oil for managing hair fall and promoting hair growth",SKU014,BAR014,513,513,0,100,0,Personal care,"Hindustan Lab","https://drive.google.com/file/d/1qAUSle-YbldoObxjVUb4p1LgtTDC8EJH/view,https://drive.google.com/file/d/1wKJu7Bww0AVfq6K8m_M6gH-9CWLwgFjb/view","hair oil,hair fall,ayurvedic",show,18,Yes,33049900,BATCH014,2026-03-31,2024-02-01,No,0,0,No,indulekha-bringha-oil-100ml,"Aloe Barbadensis Plant (0.1816 Gm) + Amalaki (0.1816 Gm) + Bacopa Monnieri Extract (0.118 Gm) + Bhringaraj (0.1816 Gm) + Draksh Munnaka (0.1816 Gm) + Glycyrrhiza Glabra Extract (0.0187 Gm) + Kadi Patta Murraya Koengu (0.473 Gm) + Karpoor (0.075 Gm) + Kshiram (0.303 Ml) + Narikela (Cocos Nucifera) (7.5 Ml) + Nimba (0.075 Gm) + Prunus Amygdalus Oil (0.118 Gm) + Tinospora Cordifolia (0.1816 Gm) + Wrightia Ticntoria (1.212 Gm)","Helps manage hair fall | Helps strengthen the hair | Nourishes the hair and scalp | Supports new hair growth | Suitable for men and women","Indulekha Bringha Oil 100ml is used for managing hair fall. It is a formulation of Bringhraj, Svetakutaja, Amla and virgin coconut oil. It is an Ayurvedic remedy that helps reduce hair loss and support hair growth. This Ayurvedic oil, which contains Bhringraj and ten other herbs, helps revitalise the roots and supports the growth of new hair.","Bringhraj: Key ingredient for herbal preparations used in the management of hair loss | Svetakutaja: Renowned for its anti-dandruff properties due to its moisturising characteristics | Amla: Helps strengthen the hair follicles, allowing for rapid growth | Virgin Coconut Oil: Helps hydrate and moisturise the hair, ensuring that it remains soft and shining","Hair Fall Reduction: Potent Ayurvedic preparation that can help manage hair loss | Supports New Hair Growth: Stimulates new hair development through nurturing effects | Provides Essential Nourishment: Combination of natural nutrients penetrate deep into the scalp | Helps Nourish Hair: Virgin coconut oil and aloe vera work as natural conditioner","For best results, use three times each week for four months | After applying the oil, wait 3-4 hours before rinsing it out with Indulekha Bringha Shampoo","Read the label carefully before use | Keep it out of the reach of children | For external use only | Store in a cool and dry place away from direct sunlight","Good to Know: Free from silicones, Paraben-free, Synthetic perfume free, Sulphate-free | Quick Tips: Leave oil overnight on the scalp, Massage the scalp with fingers in circular motion, Always part the hair to ensure oil reaches the scalp | Concerns It Can Help With: Hair fall, Hair growth, Scalp health",,A/22 Anurag | Shivram Soc | Devidayal Road | Mulund West | Mumbai - 400080 | Country of origin: INDIA,"We, at Farmacy kart make a diligent attempt to deliver accurate, expert- drafted and thoroughly reviewed medicine related information to our consumers. However, it should, by no means, be considered a substitute for prescription from a certified doctor or a trustworthy doctor-patient relationship."
PROD015,"Dr. Morepen Ortho KN 04 Knee Cap Open Patella Large","Neoprene knee cap for firm support and stability",SKU015,BAR015,460,460,0,100,0,Surgical,"Dr. Morepen Limited","https://drive.google.com/file/d/1FRy9ejd2ZhNHFam99HM6d1DvdMNYp-ef/view","knee cap,orthopedic,support",show,18,Yes,90211900,BATCH015,2027-12-31,2024-03-01,No,0,0,No,dr-morepen-ortho-kn-04-knee-cap-open-patella-large,,"Neoprene fabric ensures comfort and durability | Uniform compression provides stability to the knee | Easy application for quick and convenient use | Soft cushioning around the knee for added comfort | Suitable for both left and right knee","Dr. Morepen Ortho KN 04 Knee Cap Open Patella Large is designed to provide firm knee support with the comfort of neoprene fabric. Its soft texture offers cushioning around the knee, while uniform compression ensures stability and balanced support. The knee cap is lightweight, easy to apply, and suitable for daily use, recovery, post-casting care, or sports activity.",,"Knee Support: Provides knee support during recovery, post-casting care, sports activity, and daily use | Product Dimension: L (19.6 in - 22.0 in) (49 cm - 55 cm) | Material: Neoprene fabric for durability, flexibility, and comfort | Compression: Uniform compression for reliable support and stability | Design: Easy-to-apply design suitable for regular or sports use","Measure circumference around mid thigh-approximately 6 inches above knee | Apply the knee cap ensuring proper fit | Adjust straps for comfortable compression",,,,"Name: Morepen Laboratories Limited | Address: Morepen Village, Malkumajra, Baddi, Distt. Solan (H.P.)-173 205/Ag-82 Basement Ground Floor, Sanjay Gandhi Transport Nagar, North West Delhi-110042","We, at Farmacy kart make a diligent attempt to deliver accurate, expert- drafted and thoroughly reviewed medicine related information to our consumers. However, it should, by no means, be considered a substitute for prescription from a certified doctor or a trustworthy doctor-patient relationship."
PROD016,"Dr. Morepen Ortho KN 03 Knee Cap Neoprene Small","Neoprene knee cap with uniform compression for support",SKU016,BAR016,950,950,0,100,0,Surgical,"Dr. Morepen Limited","https://drive.google.com/file/d/1EpFS1-09s5vBiB9wwJzMGgrqRdlj0-FX/view","knee cap,neoprene,orthopedic",show,18,Yes,90211900,BATCH016,2027-12-31,2024-03-01,No,0,0,No,dr-morepen-ortho-kn-03-knee-cap-neoprene-small,,"Neoprene fabric provides softness and durability | Uniform compression delivers firm knee support | Easy application for user convenience | Soft cushioning around the knee for comfort | Suitable for both knees","Dr. Morepen Ortho KN 03 Knee Cap Neoprene Small is designed to provide firm knee support with the comfort of neoprene fabric. Its soft texture ensures cushioning around the knee, while the uniform compression offers stability and balanced support. Easy to apply and lightweight, it is suitable for recovery, post-casting care, daily use, and sports activity.","Material: Neoprene fabric for comfort, durability, and flexibility | Compression: Uniform compression ensures greater support and stability | Comfort: Soft texture around the knee for cushioning and comfort | Design: Easy-to-apply construction suitable for daily or sports use | Compatibility: Suitable for both left and right knee","Knee Support: Provides knee support and stability during recovery, post-casting care, sports activity, and daily use | Product Dimension: Universal (14.8 in -22.0 in) (37 cm - 55 cm), Spl (22.0 in -29.2 in) (55 cm -73 cm)","Apply the knee cap ensuring proper fit | Adjust for comfortable compression | Use as directed by healthcare professional",,,,"Name: Morepen Laboratories Limited | Address: Morepen Village, Malkumajra, Baddi, Distt. Solan (H.P.)-173 205/Ag-82 Basement Ground Floor, Sanjay Gandhi Transport Nagar, North West Delhi-110042","We, at Farmacy kart make a diligent attempt to deliver accurate, expert- drafted and thoroughly reviewed medicine related information to our consumers. However, it should, by no means, be considered a substitute for prescription from a certified doctor or a trustworthy doctor-patient relationship."
PROD017,"Dr. Morepen Ortho KN 05 Knee Cap Hinged XXL","Hinged knee cap with adjustable straps for stability",SKU017,BAR017,750,750,0,100,0,Surgical,"Dr. Morepen Limited","https://drive.google.com/file/d/14pBeX-Wqc129L0pVzSAVgFh4EYZ0VOR3/view","knee cap,hinged,orthopedic",show,18,Yes,90211900,BATCH017,2027-12-31,2024-03-01,No,0,0,No,dr-morepen-ortho-kn-05-knee-cap-hinged-xxl,,"Hinged knee cap with adjustable straps for stability | Provides uniform compression for balanced support | Easy to wear, remove, and maintain",,"Provides adjustable support to the knee joint: Helps maintain stability during movement | Ensures uniform compression for comfort and protection: Suitable for recovery and daily use","Adjustable Support: Provides adjustable support to the knee joint | Stability: Helps maintain stability during movement | Compression: Ensures uniform compression for comfort and protection | Size: XXL- 24.4-26.8 inches (61-67 cm)","Apply the hinged knee cap | Adjust straps for proper fit and compression | Ensure comfortable fit without excessive tightness","Use under the guidance of a healthcare professional if recovering from injury | Do not wear for prolonged periods without breaks | Remove immediately if you experience excessive tightness, discomfort, or restricted circulation | Keep out of reach of children | Read the label carefully before use",,,"Name: Morepen Laboratories Limited | Address: Morepen Village, Malkumajra, Baddi, Distt. Solan (H.P.)-173 205/Ag-82 Basement Ground Floor, Sanjay Gandhi Transport Nagar, North West Delhi-110042","We, at Farmacy kart make a diligent attempt to deliver accurate, expert- drafted and thoroughly reviewed medicine related information to our consumers. However, it should, by no means, be considered a substitute for prescription from a certified doctor or a trustworthy doctor-patient relationship."
